mysql> show databases;
+--------------------+
| Database           |
+--------------------+
| information_schema |
| hello_mysql        |
| homework           |
| homework2          |
| mysql              |
| performance_schema |
| sys                |
| work1              |
+--------------------+
8 rows in set (0.00 sec)

mysql> use homework;
Reading table information for completion of table and column names
You can turn off this feature to get a quicker startup with -A

Database changed
mysql> show tables;
+--------------------+
| Tables_in_homework |
+--------------------+
| countries          |
| departments        |
| dept               |
| emp                |
| employees          |
| job_history        |
| jobs               |
| locations          |
| regions            |
| salgrade           |
| shopcart           |
| wx                 |
| year               |
+--------------------+
13 rows in set (0.00 sec)

mysql> select * from emp;
+-------+--------+-----------+------+------------+------+---------+--------+
| EMPNO | ENAME  | JOB       | MGR  | HIREDATE   | SAL  | COMM    | DEPTNO |
+-------+--------+-----------+------+------------+------+---------+--------+
|  7369 | SMITH  | CLERK     | 7902 | 1980/12/17 |  800 |         | 20     |
|  7499 | ALLEN  | SALESMAN  | 7698 | 1981/2/20  | 1600 | 300.00  | 30     |
|  7521 | WARD   | SALESMAN  | 7698 | 1981/2/22  | 1250 | 500.00  | 30     |
|  7566 | JONES  | MANAGER   | 7839 | 1981/4/2   | 2975 |         | 20     |
|  7654 | MARTIN | SALESMAN  | 7698 | 1981/9/28  | 1250 | 1400.00 | 30     |
|  7698 | BLAKE  | MANAGER   | 7839 | 1981/5/1   | 2850 |         | 30     |
|  7782 | CLARK  | MANAGER   | 7839 | 1981/6/9   | 2450 |         | 10     |
|  7788 | SCOTT  | ANALYST   | 7566 | 1987/4/19  | 3000 |         | 20     |
|  7839 | KING   | PRESIDENT |      | 1981/11/17 | 5000 |         | 10     |
|  7844 | TURNER | SALESMAN  | 7698 | 1981/9/8   | 1500 | 0.00    | 30     |
|  7876 | ADAMS  | CLERK     | 7788 | 1987/5/23  | 1100 |         | 20     |
|  7900 | JAMES  | CLERK     | 7698 | 1981/12/3  |  950 |         | 30     |
|  7902 | FORD   | ANALYST   | 7566 | 1981/12/3  | 3000 |         | 20     |
|  7934 | MILLER | CLERK     | 7782 | 1982/1/23  | 1300 |         | 10     |
+-------+--------+-----------+------+------------+------+---------+--------+
14 rows in set (0.00 sec)

mysql> select * from dept;
+--------+------------+----------+
| DEPTNO | DNAME      | LOC      |
+--------+------------+----------+
|     10 | ACCOUNTING | NEW YORK |
|     20 | RESEARCH   | DALLAS   |
|     30 | SALES      | CHICAGO  |
|     40 | OPERATIONS | BOSTON   |
+--------+------------+----------+
4 rows in set (0.00 sec)

mysql> update emp set deptno=0 where empno=7934 and deptno=10;
Query OK, 1 row affected (0.00 sec)
Rows matched: 1  Changed: 1  Warnings: 0

mysql> select * from emp;
+-------+--------+-----------+------+------------+------+---------+--------+
| EMPNO | ENAME  | JOB       | MGR  | HIREDATE   | SAL  | COMM    | DEPTNO |
+-------+--------+-----------+------+------------+------+---------+--------+
|  7369 | SMITH  | CLERK     | 7902 | 1980/12/17 |  800 |         | 20     |
|  7499 | ALLEN  | SALESMAN  | 7698 | 1981/2/20  | 1600 | 300.00  | 30     |
|  7521 | WARD   | SALESMAN  | 7698 | 1981/2/22  | 1250 | 500.00  | 30     |
|  7566 | JONES  | MANAGER   | 7839 | 1981/4/2   | 2975 |         | 20     |
|  7654 | MARTIN | SALESMAN  | 7698 | 1981/9/28  | 1250 | 1400.00 | 30     |
|  7698 | BLAKE  | MANAGER   | 7839 | 1981/5/1   | 2850 |         | 30     |
|  7782 | CLARK  | MANAGER   | 7839 | 1981/6/9   | 2450 |         | 10     |
|  7788 | SCOTT  | ANALYST   | 7566 | 1987/4/19  | 3000 |         | 20     |
|  7839 | KING   | PRESIDENT |      | 1981/11/17 | 5000 |         | 10     |
|  7844 | TURNER | SALESMAN  | 7698 | 1981/9/8   | 1500 | 0.00    | 30     |
|  7876 | ADAMS  | CLERK     | 7788 | 1987/5/23  | 1100 |         | 20     |
|  7900 | JAMES  | CLERK     | 7698 | 1981/12/3  |  950 |         | 30     |
|  7902 | FORD   | ANALYST   | 7566 | 1981/12/3  | 3000 |         | 20     |
|  7934 | MILLER | CLERK     | 7782 | 1982/1/23  | 1300 |         | 0      |
+-------+--------+-----------+------+------------+------+---------+--------+
14 rows in set (0.00 sec)

mysql> select emp.empno from emp,dept where emp.deptno=dept.deptno;
+-------+
| empno |
+-------+
|  7369 |
|  7499 |
|  7521 |
|  7566 |
|  7654 |
|  7698 |
|  7782 |
|  7788 |
|  7839 |
|  7844 |
|  7876 |
|  7900 |
|  7902 |
+-------+
13 rows in set (0.00 sec)

mysql> select max(empno) from emp,dept where empno in(select emp.empno from emp,dept where emp.deptno=dept.deptno);
+------------+
| max(empno) |
+------------+
|       7902 |
+------------+
1 row in set (0.00 sec)
